{
  "$schema": "http://json-schema.org/draft-07/schema#",
  "$id": "https://sinister.local/schemas/plugin-manifest.schema.json",
  "title": "Sinister Plugin Manifest",
  "description": "Shared plugin-manifest schema consumable by Sinister Term, Sinister Memory, and any other lane that wants to load community/cross-lane plugins. Modeled on oh-my-pi packages/coding-agent/src/extensibility/plugins/types.ts:27-95. Validator: D:/Sinister Sanctum/automations/plugin_manifest.py. Author: RKOJ-ELENO :: 2026-05-26.",
  "type": "object",
  "required": ["name", "version", "entry_points"],
  "additionalProperties": false,
  "properties": {
    "name": {
      "type": "string",
      "minLength": 2,
      "maxLength": 64,
      "pattern": "^[a-z][a-z0-9-]*$",
      "description": "Plugin slug. kebab-case, 2-64 chars, must start with a lowercase letter."
    },
    "version": {
      "type": "string",
      "pattern": "^(0|[1-9][0-9]*)\\.(0|[1-9][0-9]*)\\.(0|[1-9][0-9]*)(?:-((?:0|[1-9][0-9]*|[0-9]*[a-zA-Z-][0-9a-zA-Z-]*)(?:\\.(?:0|[1-9][0-9]*|[0-9]*[a-zA-Z-][0-9a-zA-Z-]*))*))?(?:\\+([0-9a-zA-Z-]+(?:\\.[0-9a-zA-Z-]+)*))?$",
      "description": "Semantic version (semver 2.0.0). Example: 1.2.3 or 0.1.0-alpha.1."
    },
    "description": {
      "type": "string",
      "maxLength": 200,
      "description": "One-line plugin description (<=200 chars)."
    },
    "author": {
      "type": "string",
      "description": "Author handle. RKOJ-ELENO is canonical for in-fleet plugins."
    },
    "lanes": {
      "type": "array",
      "items": {"type": "string"},
      "description": "Sinister lanes the plugin targets. Use 'all' as a wildcard."
    },
    "entry_points": {
      "type": "object",
      "description": "Where the host should load plugin code from.",
      "additionalProperties": false,
      "properties": {
        "commands": {
          "type": "array",
          "items": {"type": "string"},
          "description": "Relative paths to Python files exposing slash-command implementations."
        },
        "hooks": {
          "type": "object",
          "description": "Map of hook-name -> relative python path (e.g. pre_turn, post_turn)."
        },
        "extensions": {
          "type": "array",
          "items": {"type": "string"},
          "description": "Relative paths to generic extension modules."
        },
        "tools": {
          "type": "array",
          "items": {"type": "string"},
          "description": "Relative paths to tool-registration modules."
        }
      }
    },
    "settings_schema": {
      "type": "object",
      "description": "Map of setting_name -> setting descriptor. Validator enforces enum_values when type=enum.",
      "additionalProperties": {
        "type": "object",
        "required": ["type"],
        "properties": {
          "type": {"type": "string", "enum": ["string", "number", "boolean", "enum"]},
          "default": {},
          "env": {"type": "string"},
          "secret": {"type": "boolean"},
          "enum_values": {"type": "array"},
          "description": {"type": "string"}
        }
      }
    },
    "features": {
      "type": "object",
      "description": "Map of feature_flag_name -> {default: bool, description?: string}.",
      "additionalProperties": {
        "type": "object",
        "required": ["default"],
        "properties": {
          "default": {"type": "boolean"},
          "description": {"type": "string"}
        }
      }
    },
    "dependencies": {
      "type": "object",
      "description": "Runtime dependencies grouped by ecosystem.",
      "additionalProperties": false,
      "properties": {
        "python": {
          "type": "object",
          "description": "Map of pip package -> version range string (e.g. '>=2.0,<3')."
        },
        "node": {
          "type": "object",
          "description": "Map of npm package -> version range string."
        }
      }
    },
    "requires_lanes": {
      "type": "array",
      "items": {"type": "string"},
      "description": "Lane slugs that MUST exist for this plugin to load."
    },
    "min_sinister_version": {
      "type": "string",
      "pattern": "^(0|[1-9][0-9]*)\\.(0|[1-9][0-9]*)\\.(0|[1-9][0-9]*)(?:-((?:0|[1-9][0-9]*|[0-9]*[a-zA-Z-][0-9a-zA-Z-]*)(?:\\.(?:0|[1-9][0-9]*|[0-9]*[a-zA-Z-][0-9a-zA-Z-]*))*))?(?:\\+([0-9a-zA-Z-]+(?:\\.[0-9a-zA-Z-]+)*))?$",
      "description": "Minimum Sinister fleet version required (semver)."
    }
  }
}
